======================================================================
🔬 Starting Fine-Tuning Experiments
======================================================================
 Results will be saved to: results/finetuning

======================================================================
 BERT Hybrid Fixed Models
======================================================================

 Configuration 1/8

======================================================================
🚀 Training: bert_hybrid_fixed
======================================================================
Config: {'d_model': 64, 'n_heads': 2, 'n_blocks': 2, 'lr': 0.001, 'dropout': 0.2, 'alpha': 0.5}
============================================================
STARTING TRAINING
============================================================
Device: cuda
Model parameters: 569,408
Training batches: 2177
Validation batches: 24
============================================================

Epoch 1: 100%|██████████| 2177/2177 [01:49<00:00, 19.83it/s, loss=0.2066]
Epoch 2: 100%|██████████| 2177/2177 [01:48<00:00, 20.00it/s, loss=0.1998]
Epoch 3: 100%|██████████| 2177/2177 [01:48<00:00, 20.00it/s, loss=0.1210]
Epoch 4: 100%|██████████| 2177/2177 [01:48<00:00, 20.01it/s, loss=0.1488]
Epoch 5: 100%|██████████| 2177/2177 [01:48<00:00, 20.03it/s, loss=0.1356]

[Epoch 5] Evaluating...
Evaluating: 100%|██████████| 24/24 [00:00<00:00, 31.58it/s]

[Epoch 5/50] Time: 109.5s
  Train Loss: 0.1386
  Val HR@10: 0.0875
  Val NDCG@10: 0.0416
  Val MRR@10: 0.0279
  ✓ New best! (0.0000 → 0.0416)
Epoch 6: 100%|██████████| 2177/2177 [01:48<00:00, 20.06it/s, loss=0.1072]
Epoch 7: 100%|██████████| 2177/2177 [01:48<00:00, 20.05it/s, loss=0.1144]
Epoch 8: 100%|██████████| 2177/2177 [01:48<00:00, 20.03it/s, loss=0.1172]
Epoch 9: 100%|██████████| 2177/2177 [01:48<00:00, 20.04it/s, loss=0.0886]
Epoch 10: 100%|██████████| 2177/2177 [01:49<00:00, 19.96it/s, loss=0.0683]

[Epoch 10] Evaluating...
Evaluating: 100%|██████████| 24/24 [00:00<00:00, 31.99it/s]

[Epoch 10/50] Time: 109.8s
  Train Loss: 0.1159
  Val HR@10: 0.0968
  Val NDCG@10: 0.0460
  Val MRR@10: 0.0309
  ✓ New best! (0.0416 → 0.0460)
Epoch 11: 100%|██████████| 2177/2177 [01:48<00:00, 20.03it/s, loss=0.1188]
Epoch 12: 100%|██████████| 2177/2177 [01:48<00:00, 20.04it/s, loss=0.1098]
Epoch 13: 100%|██████████| 2177/2177 [01:48<00:00, 20.01it/s, loss=0.0912]
Epoch 14: 100%|██████████| 2177/2177 [01:48<00:00, 20.00it/s, loss=0.0768]
Epoch 15: 100%|██████████| 2177/2177 [01:48<00:00, 20.02it/s, loss=0.0716]

[Epoch 15] Evaluating...
Evaluating: 100%|██████████| 24/24 [00:00<00:00, 31.73it/s]

[Epoch 15/50] Time: 109.5s
  Train Loss: 0.1080
  Val HR@10: 0.1077
  Val NDCG@10: 0.0506
  Val MRR@10: 0.0337
  ✓ New best! (0.0460 → 0.0506)
Epoch 16: 100%|██████████| 2177/2177 [01:48<00:00, 20.02it/s, loss=0.0926]
Epoch 17: 100%|██████████| 2177/2177 [01:48<00:00, 20.01it/s, loss=0.0919]
Epoch 18: 100%|██████████| 2177/2177 [01:48<00:00, 20.05it/s, loss=0.0716]
Epoch 19: 100%|██████████| 2177/2177 [01:48<00:00, 20.03it/s, loss=0.0902]
Epoch 20: 100%|██████████| 2177/2177 [01:48<00:00, 20.06it/s, loss=0.1407]

[Epoch 20] Evaluating...
Evaluating: 100%|██████████| 24/24 [00:00<00:00, 32.61it/s]

[Epoch 20/50] Time: 109.3s
  Train Loss: 0.1023
  Val HR@10: 0.1134
  Val NDCG@10: 0.0547
  Val MRR@10: 0.0372
  ✓ New best! (0.0506 → 0.0547)
Epoch 21: 100%|██████████| 2177/2177 [01:48<00:00, 20.03it/s, loss=0.1063]
Epoch 22: 100%|██████████| 2177/2177 [01:48<00:00, 20.05it/s, loss=0.0954]
Epoch 23: 100%|██████████| 2177/2177 [01:48<00:00, 20.07it/s, loss=0.1095]
Epoch 24: 100%|██████████| 2177/2177 [01:48<00:00, 20.07it/s, loss=0.1348]
Epoch 25: 100%|██████████| 2177/2177 [01:48<00:00, 20.07it/s, loss=0.0982]

[Epoch 25] Evaluating...
Evaluating: 100%|██████████| 24/24 [00:00<00:00, 32.77it/s]

[Epoch 25/50] Time: 109.2s
  Train Loss: 0.0994
  Val HR@10: 0.1125
  Val NDCG@10: 0.0546
  Val MRR@10: 0.0372
  No improvement (1/10)
Epoch 26: 100%|██████████| 2177/2177 [01:48<00:00, 20.05it/s, loss=0.0822]
Epoch 27: 100%|██████████| 2177/2177 [01:48<00:00, 20.06it/s, loss=0.0885]
Epoch 28: 100%|██████████| 2177/2177 [01:48<00:00, 19.99it/s, loss=0.0302]
Epoch 29: 100%|██████████| 2177/2177 [01:48<00:00, 19.99it/s, loss=0.1250]
Epoch 30: 100%|██████████| 2177/2177 [01:48<00:00, 20.00it/s, loss=0.1214]

[Epoch 30] Evaluating...
Evaluating: 100%|██████████| 24/24 [00:00<00:00, 32.30it/s]

[Epoch 30/50] Time: 109.6s
  Train Loss: 0.0960
  Val HR@10: 0.1306
  Val NDCG@10: 0.0587
  Val MRR@10: 0.0373
  ✓ New best! (0.0547 → 0.0587)
Epoch 31: 100%|██████████| 2177/2177 [01:48<00:00, 20.04it/s, loss=0.0655]
Epoch 32: 100%|██████████| 2177/2177 [01:49<00:00, 19.87it/s, loss=0.1114]
Epoch 33: 100%|██████████| 2177/2177 [01:48<00:00, 20.05it/s, loss=0.1006]
Epoch 34: 100%|██████████| 2177/2177 [01:48<00:00, 20.05it/s, loss=0.1105]
Epoch 35: 100%|██████████| 2177/2177 [01:48<00:00, 20.06it/s, loss=0.1329]

[Epoch 35] Evaluating...
Evaluating: 100%|██████████| 24/24 [00:00<00:00, 32.18it/s]

[Epoch 35/50] Time: 109.3s
  Train Loss: 0.0930
  Val HR@10: 0.1321
  Val NDCG@10: 0.0610
  Val MRR@10: 0.0398
  ✓ New best! (0.0587 → 0.0610)
Epoch 36: 100%|██████████| 2177/2177 [01:48<00:00, 20.07it/s, loss=0.1642]
Epoch 37: 100%|██████████| 2177/2177 [01:48<00:00, 20.07it/s, loss=0.0994]
Epoch 38: 100%|██████████| 2177/2177 [01:48<00:00, 20.06it/s, loss=0.1300]
Epoch 39: 100%|██████████| 2177/2177 [01:48<00:00, 20.06it/s, loss=0.1005]
Epoch 40: 100%|██████████| 2177/2177 [01:48<00:00, 20.02it/s, loss=0.1091]

[Epoch 40] Evaluating...
Evaluating: 100%|██████████| 24/24 [00:00<00:00, 32.18it/s]

[Epoch 40/50] Time: 109.5s
  Train Loss: 0.0909
  Val HR@10: 0.1283
  Val NDCG@10: 0.0600
  Val MRR@10: 0.0396
  No improvement (1/10)
Epoch 41: 100%|██████████| 2177/2177 [01:48<00:00, 20.06it/s, loss=0.0897]
Epoch 42: 100%|██████████| 2177/2177 [01:48<00:00, 20.06it/s, loss=0.0897]
Epoch 43: 100%|██████████| 2177/2177 [01:48<00:00, 20.02it/s, loss=0.0461]
Epoch 44: 100%|██████████| 2177/2177 [01:48<00:00, 20.01it/s, loss=0.0994]
Epoch 45: 100%|██████████| 2177/2177 [01:48<00:00, 20.01it/s, loss=0.1226]

[Epoch 45] Evaluating...
Evaluating: 100%|██████████| 24/24 [00:00<00:00, 32.62it/s]

[Epoch 45/50] Time: 109.5s
  Train Loss: 0.0890
  Val HR@10: 0.1265
  Val NDCG@10: 0.0599
  Val MRR@10: 0.0401
  No improvement (2/10)
Epoch 46: 100%|██████████| 2177/2177 [01:48<00:00, 20.04it/s, loss=0.1430]
Epoch 47: 100%|██████████| 2177/2177 [01:48<00:00, 20.02it/s, loss=0.0786]
Epoch 48: 100%|██████████| 2177/2177 [01:48<00:00, 20.04it/s, loss=0.0631]
Epoch 49: 100%|██████████| 2177/2177 [01:48<00:00, 20.03it/s, loss=0.0937]
Epoch 50: 100%|██████████| 2177/2177 [01:48<00:00, 20.04it/s, loss=0.0907]

[Epoch 50] Evaluating...
Evaluating: 100%|██████████| 24/24 [00:00<00:00, 32.46it/s]

[Epoch 50/50] Time: 109.4s
  Train Loss: 0.0882
  Val HR@10: 0.1407
  Val NDCG@10: 0.0668
  Val MRR@10: 0.0447
  ✓ New best! (0.0610 → 0.0668)

============================================================
TRAINING COMPLETE
============================================================
Total time: 90.7 minutes
Best epoch: 50
Best val NDCG@10: 0.0668
============================================================

❌ Error in configuration 1: list index out of range

 Configuration 2/8

======================================================================
🚀 Training: bert_hybrid_fixed
======================================================================
Config: {'d_model': 64, 'n_heads': 2, 'n_blocks': 2, 'lr': 0.001, 'dropout': 0.2, 'alpha': 0.3}
============================================================
STARTING TRAINING
============================================================
Device: cuda
Model parameters: 569,408
Training batches: 2177
Validation batches: 24
============================================================

Epoch 1: 100%|██████████| 2177/2177 [01:48<00:00, 20.07it/s, loss=0.2293]
Epoch 2: 100%|██████████| 2177/2177 [01:48<00:00, 20.06it/s, loss=0.1600]
Epoch 3: 100%|██████████| 2177/2177 [01:48<00:00, 20.05it/s, loss=0.1670]
Epoch 4: 100%|██████████| 2177/2177 [01:48<00:00, 20.07it/s, loss=0.1021]
Epoch 5: 100%|██████████| 2177/2177 [01:48<00:00, 20.05it/s, loss=0.1681]

[Epoch 5] Evaluating...
Evaluating: 100%|██████████| 24/24 [00:00<00:00, 31.85it/s]

[Epoch 5/50] Time: 109.3s
  Train Loss: 0.1393
  Val HR@10: 0.0885
  Val NDCG@10: 0.0417
  Val MRR@10: 0.0277
  ✓ New best! (0.0000 → 0.0417)
Epoch 6: 100%|██████████| 2177/2177 [01:48<00:00, 20.04it/s, loss=0.1085]
Epoch 7: 100%|██████████| 2177/2177 [01:48<00:00, 20.05it/s, loss=0.1484]
Epoch 8: 100%|██████████| 2177/2177 [01:48<00:00, 20.04it/s, loss=0.0898]
Epoch 9: 100%|██████████| 2177/2177 [01:48<00:00, 20.06it/s, loss=0.1324]
Epoch 10: 100%|██████████| 2177/2177 [01:48<00:00, 20.06it/s, loss=0.0630]

[Epoch 10] Evaluating...
Evaluating: 100%|██████████| 24/24 [00:00<00:00, 31.49it/s]

[Epoch 10/50] Time: 109.3s
  Train Loss: 0.1175
  Val HR@10: 0.1139
  Val NDCG@10: 0.0540
  Val MRR@10: 0.0361
  ✓ New best! (0.0417 → 0.0540)
Epoch 11: 100%|██████████| 2177/2177 [01:48<00:00, 20.06it/s, loss=0.0865]
Epoch 12: 100%|██████████| 2177/2177 [01:48<00:00, 20.06it/s, loss=0.1196]
Epoch 13: 100%|██████████| 2177/2177 [01:48<00:00, 20.05it/s, loss=0.1195]
Epoch 14: 100%|██████████| 2177/2177 [01:48<00:00, 20.05it/s, loss=0.1266]
Epoch 15: 100%|██████████| 2177/2177 [01:48<00:00, 20.03it/s, loss=0.0836]

[Epoch 15] Evaluating...
Evaluating: 100%|██████████| 24/24 [00:00<00:00, 31.94it/s]

[Epoch 15/50] Time: 109.4s
  Train Loss: 0.1087
  Val HR@10: 0.1173
  Val NDCG@10: 0.0536
  Val MRR@10: 0.0346
  No improvement (1/10)
Epoch 16: 100%|██████████| 2177/2177 [01:48<00:00, 20.06it/s, loss=0.0490]
Epoch 17: 100%|██████████| 2177/2177 [01:48<00:00, 20.07it/s, loss=0.0911]
Epoch 18: 100%|██████████| 2177/2177 [01:48<00:00, 20.07it/s, loss=0.1221]
Epoch 19: 100%|██████████| 2177/2177 [01:48<00:00, 20.06it/s, loss=0.1153]
Epoch 20: 100%|██████████| 2177/2177 [01:48<00:00, 20.05it/s, loss=0.0564]

[Epoch 20] Evaluating...
Evaluating: 100%|██████████| 24/24 [00:00<00:00, 32.03it/s]

[Epoch 20/50] Time: 109.4s
  Train Loss: 0.1035
  Val HR@10: 0.1258
  Val NDCG@10: 0.0603
  Val MRR@10: 0.0407
  ✓ New best! (0.0540 → 0.0603)
Epoch 21: 100%|██████████| 2177/2177 [01:48<00:00, 20.03it/s, loss=0.1072]
Epoch 22: 100%|██████████| 2177/2177 [01:49<00:00, 19.93it/s, loss=0.0465]
Epoch 23: 100%|██████████| 2177/2177 [01:48<00:00, 20.01it/s, loss=0.1388]
Epoch 24: 100%|██████████| 2177/2177 [01:48<00:00, 20.03it/s, loss=0.0875]
Epoch 25: 100%|██████████| 2177/2177 [01:48<00:00, 20.03it/s, loss=0.1136]

[Epoch 25] Evaluating...
Evaluating: 100%|██████████| 24/24 [00:00<00:00, 32.07it/s]

[Epoch 25/50] Time: 109.4s
  Train Loss: 0.0990
  Val HR@10: 0.1183
  Val NDCG@10: 0.0564
  Val MRR@10: 0.0379
  No improvement (1/10)
Epoch 26: 100%|██████████| 2177/2177 [01:48<00:00, 20.03it/s, loss=0.0587]
Epoch 27: 100%|██████████| 2177/2177 [01:48<00:00, 20.04it/s, loss=0.1111]
Epoch 28: 100%|██████████| 2177/2177 [01:48<00:00, 20.04it/s, loss=0.1305]
Epoch 29: 100%|██████████| 2177/2177 [01:48<00:00, 20.03it/s, loss=0.0731]
Epoch 30: 100%|██████████| 2177/2177 [01:48<00:00, 20.00it/s, loss=0.0644]

[Epoch 30] Evaluating...
Evaluating: 100%|██████████| 24/24 [00:00<00:00, 32.15it/s]

[Epoch 30/50] Time: 109.6s
  Train Loss: 0.0967
  Val HR@10: 0.1228
  Val NDCG@10: 0.0587
  Val MRR@10: 0.0396
  No improvement (2/10)
Epoch 31: 100%|██████████| 2177/2177 [01:48<00:00, 20.04it/s, loss=0.0642]
Epoch 32: 100%|██████████| 2177/2177 [01:48<00:00, 20.06it/s, loss=0.0991]
Epoch 33: 100%|██████████| 2177/2177 [01:48<00:00, 20.04it/s, loss=0.1089]
Epoch 34: 100%|██████████| 2177/2177 [01:48<00:00, 20.09it/s, loss=0.0896]
Epoch 35: 100%|██████████| 2177/2177 [01:48<00:00, 20.09it/s, loss=0.0701]

[Epoch 35] Evaluating...
Evaluating: 100%|██████████| 24/24 [00:00<00:00, 31.80it/s]

[Epoch 35/50] Time: 109.1s
  Train Loss: 0.0941
  Val HR@10: 0.1382
  Val NDCG@10: 0.0649
  Val MRR@10: 0.0430
  ✓ New best! (0.0603 → 0.0649)
Epoch 36: 100%|██████████| 2177/2177 [01:48<00:00, 20.09it/s, loss=0.0924]
Epoch 37: 100%|██████████| 2177/2177 [01:48<00:00, 20.09it/s, loss=0.0417]
Epoch 38: 100%|██████████| 2177/2177 [01:48<00:00, 20.10it/s, loss=0.0845]
Epoch 39: 100%|██████████| 2177/2177 [01:48<00:00, 20.08it/s, loss=0.1170]
Epoch 40: 100%|██████████| 2177/2177 [01:49<00:00, 19.94it/s, loss=0.1858]

[Epoch 40] Evaluating...
Evaluating: 100%|██████████| 24/24 [00:00<00:00, 32.26it/s]

[Epoch 40/50] Time: 109.9s
  Train Loss: 0.0918
  Val HR@10: 0.1306
  Val NDCG@10: 0.0609
  Val MRR@10: 0.0401
  No improvement (1/10)
Epoch 41: 100%|██████████| 2177/2177 [01:49<00:00, 19.93it/s, loss=0.0714]
Epoch 42: 100%|██████████| 2177/2177 [01:49<00:00, 19.93it/s, loss=0.0975]
Epoch 43: 100%|██████████| 2177/2177 [01:49<00:00, 19.93it/s, loss=0.0748]
Epoch 44: 100%|██████████| 2177/2177 [01:48<00:00, 20.08it/s, loss=0.1638]
Epoch 45: 100%|██████████| 2177/2177 [01:48<00:00, 20.08it/s, loss=0.0728]

[Epoch 45] Evaluating...
Evaluating: 100%|██████████| 24/24 [00:00<00:00, 32.16it/s]

[Epoch 45/50] Time: 109.2s
  Train Loss: 0.0906
  Val HR@10: 0.1291
  Val NDCG@10: 0.0631
  Val MRR@10: 0.0433
  No improvement (2/10)
Epoch 46: 100%|██████████| 2177/2177 [01:48<00:00, 20.08it/s, loss=0.0991]
Epoch 47: 100%|██████████| 2177/2177 [01:48<00:00, 20.09it/s, loss=0.0981]
Epoch 48: 100%|██████████| 2177/2177 [01:48<00:00, 20.14it/s, loss=0.0682]
Epoch 49: 100%|██████████| 2177/2177 [01:48<00:00, 20.14it/s, loss=0.0981]
Epoch 50: 100%|██████████| 2177/2177 [01:48<00:00, 20.10it/s, loss=0.0972]

[Epoch 50] Evaluating...
Evaluating: 100%|██████████| 24/24 [00:00<00:00, 32.77it/s]

[Epoch 50/50] Time: 109.0s
  Train Loss: 0.0895
  Val HR@10: 0.1410
  Val NDCG@10: 0.0691
  Val MRR@10: 0.0474
  ✓ New best! (0.0649 → 0.0691)

============================================================
TRAINING COMPLETE
============================================================
Total time: 90.6 minutes
Best epoch: 50
Best val NDCG@10: 0.0691
============================================================

❌ Error in configuration 2: list index out of range

 Configuration 3/8

======================================================================
🚀 Training: bert_hybrid_fixed
======================================================================
Config: {'d_model': 64, 'n_heads': 2, 'n_blocks': 2, 'lr': 0.001, 'dropout': 0.2, 'alpha': 0.7}
============================================================
STARTING TRAINING
============================================================
Device: cuda
Model parameters: 569,408
Training batches: 2177
Validation batches: 24
============================================================

Epoch 1: 100%|██████████| 2177/2177 [01:47<00:00, 20.20it/s, loss=0.2556]
Epoch 2: 100%|██████████| 2177/2177 [01:47<00:00, 20.19it/s, loss=0.0999]
Epoch 3: 100%|██████████| 2177/2177 [01:47<00:00, 20.20it/s, loss=0.1632]
Epoch 4: 100%|██████████| 2177/2177 [01:47<00:00, 20.17it/s, loss=0.1093]
Epoch 5: 100%|██████████| 2177/2177 [01:47<00:00, 20.16it/s, loss=0.1084]

[Epoch 5] Evaluating...
Evaluating: 100%|██████████| 24/24 [00:00<00:00, 32.44it/s]

[Epoch 5/50] Time: 108.7s
  Train Loss: 0.1403
  Val HR@10: 0.0840
  Val NDCG@10: 0.0396
  Val MRR@10: 0.0264
  ✓ New best! (0.0000 → 0.0396)
Epoch 6: 100%|██████████| 2177/2177 [01:49<00:00, 19.96it/s, loss=0.0900]
Epoch 7: 100%|██████████| 2177/2177 [01:47<00:00, 20.16it/s, loss=0.0885]
Epoch 8: 100%|██████████| 2177/2177 [01:47<00:00, 20.17it/s, loss=0.1525]
Epoch 9: 100%|██████████| 2177/2177 [01:47<00:00, 20.17it/s, loss=0.1559]
Epoch 10: 100%|██████████| 2177/2177 [01:47<00:00, 20.16it/s, loss=0.0967]

[Epoch 10] Evaluating...
Evaluating: 100%|██████████| 24/24 [00:00<00:00, 32.87it/s]

[Epoch 10/50] Time: 108.7s
  Train Loss: 0.1158
  Val HR@10: 0.1036
  Val NDCG@10: 0.0495
  Val MRR@10: 0.0334
  ✓ New best! (0.0396 → 0.0495)
Epoch 11: 100%|██████████| 2177/2177 [01:47<00:00, 20.17it/s, loss=0.1961]
Epoch 12: 100%|██████████| 2177/2177 [01:47<00:00, 20.17it/s, loss=0.1051]
Epoch 13: 100%|██████████| 2177/2177 [01:47<00:00, 20.17it/s, loss=0.0832]
Epoch 14: 100%|██████████| 2177/2177 [01:47<00:00, 20.17it/s, loss=0.0966]
Epoch 15: 100%|██████████| 2177/2177 [01:47<00:00, 20.17it/s, loss=0.1166]

[Epoch 15] Evaluating...
Evaluating: 100%|██████████| 24/24 [00:00<00:00, 32.59it/s]

[Epoch 15/50] Time: 108.7s
  Train Loss: 0.1061
  Val HR@10: 0.1079
  Val NDCG@10: 0.0520
  Val MRR@10: 0.0353
  ✓ New best! (0.0495 → 0.0520)
Epoch 16: 100%|██████████| 2177/2177 [01:47<00:00, 20.17it/s, loss=0.1484]
Epoch 17: 100%|██████████| 2177/2177 [01:47<00:00, 20.17it/s, loss=0.1049]
Epoch 18: 100%|██████████| 2177/2177 [01:47<00:00, 20.18it/s, loss=0.1061]
Epoch 19: 100%|██████████| 2177/2177 [01:47<00:00, 20.17it/s, loss=0.0579]
Epoch 20: 100%|██████████| 2177/2177 [01:47<00:00, 20.17it/s, loss=0.0488]

[Epoch 20] Evaluating...
Evaluating: 100%|██████████| 24/24 [00:00<00:00, 32.40it/s]

[Epoch 20/50] Time: 108.7s
  Train Loss: 0.1005
  Val HR@10: 0.1094
  Val NDCG@10: 0.0513
  Val MRR@10: 0.0340
  No improvement (1/10)
Epoch 21: 100%|██████████| 2177/2177 [01:47<00:00, 20.17it/s, loss=0.1660]
Epoch 22: 100%|██████████| 2177/2177 [01:47<00:00, 20.17it/s, loss=0.1312]
Epoch 23: 100%|██████████| 2177/2177 [01:48<00:00, 20.09it/s, loss=0.1336]
Epoch 24: 100%|██████████| 2177/2177 [01:48<00:00, 20.05it/s, loss=0.1553]
Epoch 25: 100%|██████████| 2177/2177 [01:47<00:00, 20.20it/s, loss=0.0482]

[Epoch 25] Evaluating...
Evaluating: 100%|██████████| 24/24 [00:00<00:00, 32.64it/s]

[Epoch 25/50] Time: 108.5s
  Train Loss: 0.0961
  Val HR@10: 0.1226
  Val NDCG@10: 0.0594
  Val MRR@10: 0.0404
  ✓ New best! (0.0520 → 0.0594)
Epoch 26: 100%|██████████| 2177/2177 [01:47<00:00, 20.20it/s, loss=0.0966]
Epoch 27: 100%|██████████| 2177/2177 [01:47<00:00, 20.21it/s, loss=0.1707]
Epoch 28: 100%|██████████| 2177/2177 [01:47<00:00, 20.21it/s, loss=0.0544]
Epoch 29: 100%|██████████| 2177/2177 [01:47<00:00, 20.21it/s, loss=0.1051]
Epoch 30: 100%|██████████| 2177/2177 [01:47<00:00, 20.21it/s, loss=0.1026]

[Epoch 30] Evaluating...
Evaluating: 100%|██████████| 24/24 [00:00<00:00, 32.44it/s]

[Epoch 30/50] Time: 108.5s
  Train Loss: 0.0931
  Val HR@10: 0.1241
  Val NDCG@10: 0.0611
  Val MRR@10: 0.0422
  ✓ New best! (0.0594 → 0.0611)
Epoch 31: 100%|██████████| 2177/2177 [01:47<00:00, 20.19it/s, loss=0.1230]
Epoch 32: 100%|██████████| 2177/2177 [01:47<00:00, 20.22it/s, loss=0.1106]
Epoch 33: 100%|██████████| 2177/2177 [01:47<00:00, 20.21it/s, loss=0.1255]
Epoch 34: 100%|██████████| 2177/2177 [01:47<00:00, 20.22it/s, loss=0.0393]
Epoch 35: 100%|██████████| 2177/2177 [01:47<00:00, 20.22it/s, loss=0.0918]

[Epoch 35] Evaluating...
Evaluating: 100%|██████████| 24/24 [00:00<00:00, 30.79it/s]

[Epoch 35/50] Time: 108.5s
  Train Loss: 0.0910
  Val HR@10: 0.1241
  Val NDCG@10: 0.0569
  Val MRR@10: 0.0369
  No improvement (1/10)
Epoch 36: 100%|██████████| 2177/2177 [01:47<00:00, 20.22it/s, loss=0.1265]
Epoch 37: 100%|██████████| 2177/2177 [01:47<00:00, 20.22it/s, loss=0.0815]
Epoch 38: 100%|██████████| 2177/2177 [01:47<00:00, 20.22it/s, loss=0.1142]
Epoch 39: 100%|██████████| 2177/2177 [01:47<00:00, 20.21it/s, loss=0.0568]
Epoch 40: 100%|██████████| 2177/2177 [01:47<00:00, 20.19it/s, loss=0.1626]

[Epoch 40] Evaluating...
Evaluating: 100%|██████████| 24/24 [00:00<00:00, 32.43it/s]

[Epoch 40/50] Time: 108.6s
  Train Loss: 0.0889
  Val HR@10: 0.1318
  Val NDCG@10: 0.0617
  Val MRR@10: 0.0408
  ✓ New best! (0.0611 → 0.0617)
Epoch 41: 100%|██████████| 2177/2177 [01:47<00:00, 20.16it/s, loss=0.1475]
Epoch 42: 100%|██████████| 2177/2177 [01:47<00:00, 20.18it/s, loss=0.0711]
Epoch 43: 100%|██████████| 2177/2177 [01:47<00:00, 20.20it/s, loss=0.0756]
Epoch 44: 100%|██████████| 2177/2177 [01:47<00:00, 20.21it/s, loss=0.0889]
Epoch 45: 100%|██████████| 2177/2177 [01:47<00:00, 20.20it/s, loss=0.0790]

[Epoch 45] Evaluating...
Evaluating: 100%|██████████| 24/24 [00:00<00:00, 32.32it/s]

[Epoch 45/50] Time: 108.5s
  Train Loss: 0.0870
  Val HR@10: 0.1243
  Val NDCG@10: 0.0584
  Val MRR@10: 0.0388
  No improvement (1/10)
Epoch 46: 100%|██████████| 2177/2177 [01:48<00:00, 20.14it/s, loss=0.0892]
Epoch 47: 100%|██████████| 2177/2177 [01:47<00:00, 20.16it/s, loss=0.0906]
Epoch 48: 100%|██████████| 2177/2177 [01:49<00:00, 19.95it/s, loss=0.0813]
Epoch 49: 100%|██████████| 2177/2177 [01:48<00:00, 20.08it/s, loss=0.1438]
Epoch 50: 100%|██████████| 2177/2177 [01:48<00:00, 20.00it/s, loss=0.1176]

[Epoch 50] Evaluating...
Evaluating: 100%|██████████| 24/24 [00:00<00:00, 32.69it/s]

[Epoch 50/50] Time: 109.6s
  Train Loss: 0.0846
  Val HR@10: 0.1284
  Val NDCG@10: 0.0609
  Val MRR@10: 0.0408
  No improvement (2/10)

============================================================
TRAINING COMPLETE
============================================================
Total time: 90.1 minutes
Best epoch: 40
Best val NDCG@10: 0.0617
============================================================

❌ Error in configuration 3: list index out of range

 Configuration 4/8

======================================================================
🚀 Training: bert_hybrid_fixed
======================================================================
Config: {'d_model': 64, 'n_heads': 2, 'n_blocks': 2, 'lr': 0.0005, 'dropout': 0.2, 'alpha': 0.5}
============================================================
STARTING TRAINING
============================================================
Device: cuda
Model parameters: 569,408
Training batches: 2177
Validation batches: 24
============================================================

Epoch 1: 100%|██████████| 2177/2177 [01:48<00:00, 20.14it/s, loss=0.2025]
Epoch 2: 100%|██████████| 2177/2177 [01:48<00:00, 20.15it/s, loss=0.1436]
Epoch 3: 100%|██████████| 2177/2177 [01:47<00:00, 20.17it/s, loss=0.1308]
Epoch 4: 100%|██████████| 2177/2177 [01:47<00:00, 20.16it/s, loss=0.1336]
Epoch 5: 100%|██████████| 2177/2177 [01:47<00:00, 20.16it/s, loss=0.1278]

[Epoch 5] Evaluating...
Evaluating: 100%|██████████| 24/24 [00:00<00:00, 32.22it/s]

[Epoch 5/50] Time: 108.7s
  Train Loss: 0.1431
  Val HR@10: 0.0799
  Val NDCG@10: 0.0369
  Val MRR@10: 0.0241
  ✓ New best! (0.0000 → 0.0369)
Epoch 6: 100%|██████████| 2177/2177 [01:47<00:00, 20.17it/s, loss=0.0860]
Epoch 7: 100%|██████████| 2177/2177 [01:47<00:00, 20.19it/s, loss=0.0920]
Epoch 8: 100%|██████████| 2177/2177 [01:47<00:00, 20.20it/s, loss=0.1436]
Epoch 9: 100%|██████████| 2177/2177 [01:47<00:00, 20.17it/s, loss=0.1412]
Epoch 10: 100%|██████████| 2177/2177 [01:47<00:00, 20.20it/s, loss=0.0780]

[Epoch 10] Evaluating...
Evaluating: 100%|██████████| 24/24 [00:00<00:00, 32.17it/s]

[Epoch 10/50] Time: 108.5s
  Train Loss: 0.1174
  Val HR@10: 0.1028
  Val NDCG@10: 0.0505
  Val MRR@10: 0.0349
  ✓ New best! (0.0369 → 0.0505)
Epoch 11: 100%|██████████| 2177/2177 [01:47<00:00, 20.18it/s, loss=0.1344]
Epoch 12: 100%|██████████| 2177/2177 [01:47<00:00, 20.19it/s, loss=0.0715]
Epoch 13: 100%|██████████| 2177/2177 [01:47<00:00, 20.21it/s, loss=0.1049]
Epoch 14: 100%|██████████| 2177/2177 [01:47<00:00, 20.19it/s, loss=0.1384]
Epoch 15: 100%|██████████| 2177/2177 [01:47<00:00, 20.21it/s, loss=0.1056]

[Epoch 15] Evaluating...
Evaluating: 100%|██████████| 24/24 [00:00<00:00, 32.93it/s]

[Epoch 15/50] Time: 108.4s
  Train Loss: 0.1067
  Val HR@10: 0.1157
  Val NDCG@10: 0.0544
  Val MRR@10: 0.0361
  ✓ New best! (0.0505 → 0.0544)
Epoch 16: 100%|██████████| 2177/2177 [01:47<00:00, 20.21it/s, loss=0.0616]
Epoch 17: 100%|██████████| 2177/2177 [01:47<00:00, 20.21it/s, loss=0.0952]
Epoch 18: 100%|██████████| 2177/2177 [01:47<00:00, 20.21it/s, loss=0.1896]
Epoch 19: 100%|██████████| 2177/2177 [01:47<00:00, 20.20it/s, loss=0.1426]
Epoch 20: 100%|██████████| 2177/2177 [01:47<00:00, 20.21it/s, loss=0.1021]

[Epoch 20] Evaluating...
Evaluating: 100%|██████████| 24/24 [00:00<00:00, 32.13it/s]

[Epoch 20/50] Time: 108.5s
  Train Loss: 0.1000
  Val HR@10: 0.1231
  Val NDCG@10: 0.0589
  Val MRR@10: 0.0397
  ✓ New best! (0.0544 → 0.0589)
Epoch 21: 100%|██████████| 2177/2177 [01:47<00:00, 20.18it/s, loss=0.1445]
Epoch 22: 100%|██████████| 2177/2177 [01:47<00:00, 20.21it/s, loss=0.0774]
Epoch 23: 100%|██████████| 2177/2177 [01:47<00:00, 20.21it/s, loss=0.0914]
Epoch 24: 100%|██████████| 2177/2177 [01:47<00:00, 20.21it/s, loss=0.1229]
Epoch 25: 100%|██████████| 2177/2177 [01:47<00:00, 20.20it/s, loss=0.1273]

[Epoch 25] Evaluating...
Evaluating: 100%|██████████| 24/24 [00:00<00:00, 32.95it/s]

[Epoch 25/50] Time: 108.5s
  Train Loss: 0.0953
  Val HR@10: 0.1260
  Val NDCG@10: 0.0602
  Val MRR@10: 0.0406
  ✓ New best! (0.0589 → 0.0602)
Epoch 26: 100%|██████████| 2177/2177 [01:47<00:00, 20.20it/s, loss=0.1198]
Epoch 27: 100%|██████████| 2177/2177 [01:48<00:00, 20.07it/s, loss=0.1291]
Epoch 28: 100%|██████████| 2177/2177 [01:48<00:00, 20.04it/s, loss=0.0914]
Epoch 29: 100%|██████████| 2177/2177 [01:48<00:00, 20.05it/s, loss=0.0964]
Epoch 30: 100%|██████████| 2177/2177 [01:48<00:00, 20.07it/s, loss=0.0804]

[Epoch 30] Evaluating...
Evaluating: 100%|██████████| 24/24 [00:00<00:00, 32.36it/s]

[Epoch 30/50] Time: 109.2s
  Train Loss: 0.0917
  Val HR@10: 0.1304
  Val NDCG@10: 0.0615
  Val MRR@10: 0.0410
  ✓ New best! (0.0602 → 0.0615)
Epoch 31: 100%|██████████| 2177/2177 [01:48<00:00, 20.08it/s, loss=0.0730]
Epoch 32: 100%|██████████| 2177/2177 [01:48<00:00, 20.08it/s, loss=0.0918]
Epoch 33: 100%|██████████| 2177/2177 [01:48<00:00, 20.08it/s, loss=0.1405]
Epoch 34: 100%|██████████| 2177/2177 [01:48<00:00, 20.07it/s, loss=0.1605]
Epoch 35: 100%|██████████| 2177/2177 [01:47<00:00, 20.16it/s, loss=0.0931]

[Epoch 35] Evaluating...
Evaluating: 100%|██████████| 24/24 [00:00<00:00, 32.45it/s]

[Epoch 35/50] Time: 108.7s
  Train Loss: 0.0888
  Val HR@10: 0.1400
  Val NDCG@10: 0.0663
  Val MRR@10: 0.0443
  ✓ New best! (0.0615 → 0.0663)
Epoch 36: 100%|██████████| 2177/2177 [01:47<00:00, 20.19it/s, loss=0.2041]
Epoch 37: 100%|██████████| 2177/2177 [01:47<00:00, 20.21it/s, loss=0.0564]
Epoch 38: 100%|██████████| 2177/2177 [01:47<00:00, 20.21it/s, loss=0.1586]
Epoch 39: 100%|██████████| 2177/2177 [01:47<00:00, 20.20it/s, loss=0.0965]
Epoch 40: 100%|██████████| 2177/2177 [01:47<00:00, 20.21it/s, loss=0.1263]

[Epoch 40] Evaluating...
Evaluating: 100%|██████████| 24/24 [00:00<00:00, 32.19it/s]

[Epoch 40/50] Time: 108.5s
  Train Loss: 0.0864
  Val HR@10: 0.1241
  Val NDCG@10: 0.0607
  Val MRR@10: 0.0417
  No improvement (1/10)
Epoch 41: 100%|██████████| 2177/2177 [01:47<00:00, 20.20it/s, loss=0.0401]
Epoch 42: 100%|██████████| 2177/2177 [01:48<00:00, 20.03it/s, loss=0.0899]
Epoch 43: 100%|██████████| 2177/2177 [01:48<00:00, 19.98it/s, loss=0.1106]
Epoch 44: 100%|██████████| 2177/2177 [01:48<00:00, 20.03it/s, loss=0.0789]
Epoch 45: 100%|██████████| 2177/2177 [01:48<00:00, 20.03it/s, loss=0.0845]

[Epoch 45] Evaluating...
Evaluating: 100%|██████████| 24/24 [00:00<00:00, 31.40it/s]

[Epoch 45/50] Time: 109.5s
  Train Loss: 0.0848
  Val HR@10: 0.1314
  Val NDCG@10: 0.0623
  Val MRR@10: 0.0415
  No improvement (2/10)
Epoch 46: 100%|██████████| 2177/2177 [01:48<00:00, 20.05it/s, loss=0.0640]
Epoch 47: 100%|██████████| 2177/2177 [01:48<00:00, 20.05it/s, loss=0.1154]
Epoch 48: 100%|██████████| 2177/2177 [01:48<00:00, 20.05it/s, loss=0.0430]
Epoch 49: 100%|██████████| 2177/2177 [01:48<00:00, 20.06it/s, loss=0.1358]
Epoch 50: 100%|██████████| 2177/2177 [01:47<00:00, 20.20it/s, loss=0.1133]

[Epoch 50] Evaluating...
Evaluating: 100%|██████████| 24/24 [00:00<00:00, 32.28it/s]

[Epoch 50/50] Time: 108.5s
  Train Loss: 0.0826
  Val HR@10: 0.1458
  Val NDCG@10: 0.0676
  Val MRR@10: 0.0445
  ✓ New best! (0.0663 → 0.0676)

============================================================
TRAINING COMPLETE
============================================================
Total time: 90.2 minutes
Best epoch: 50
Best val NDCG@10: 0.0676
============================================================

❌ Error in configuration 4: list index out of range

 Configuration 5/8

======================================================================
🚀 Training: bert_hybrid_fixed
======================================================================
Config: {'d_model': 64, 'n_heads': 2, 'n_blocks': 2, 'lr': 0.002, 'dropout': 0.2, 'alpha': 0.5}
============================================================
STARTING TRAINING
============================================================
Device: cuda
Model parameters: 569,408
Training batches: 2177
Validation batches: 24
============================================================

Epoch 1: 100%|██████████| 2177/2177 [01:48<00:00, 20.16it/s, loss=0.3215]
Epoch 2:  28%|██▊       | 610/2177 [00:30<01:17, 20.22it/s, loss=0.2591]